{
  "_meta": {
    "version": "1.0.0",
    "generated": "2026-01-31T00:00:00Z",
    "source": "auto-extracted from /ports/buzios.html"
  },
  "port_slug": "buzios",
  "port_name": "Búzios",
  "port_pin": {
    "lat": -22.7489,
    "lon": -41.8819,
    "label": "Armação Pier"
  },
  "bbox_hint": {
    "south": -22.8,
    "west": -41.92,
    "north": -22.72,
    "east": -41.85
  },
  "poi_ids": [
    "buzios-armacao",
    "buzios-joao-fernandes",
    "buzios-rua-das-pedras"
  ]
}
