{
  "_meta": {
    "version": "1.0.0",
    "generated": "2026-01-31T00:00:00Z",
    "source": "auto-extracted from /ports/airlie-beach.html"
  },
  "port_slug": "airlie-beach",
  "port_name": "Airlie Beach",
  "port_pin": {
    "lat": -20.2686,
    "lon": 148.7181,
    "label": "Cruise Terminal (Outer Reef)"
  },
  "bbox_hint": {
    "south": -20.35,
    "west": 148.6,
    "north": -20.18,
    "east": 148.8
  },
  "poi_ids": []
}
