{
  "_meta": {
    "version": "1.0.0",
    "generated": "2026-01-31T00:00:00Z",
    "source": "auto-extracted from /ports/port-arthur.html"
  },
  "port_slug": "port-arthur",
  "port_name": "Port Arthur",
  "port_pin": {
    "lat": -43.1467,
    "lon": 147.8517,
    "label": "Port Arthur Historic Site"
  },
  "bbox_hint": {
    "south": -43.2,
    "west": 147.8,
    "north": -43.1,
    "east": 147.9
  },
  "poi_ids": [
    "port-arthur-historic-site",
    "port-arthur-isle-of-dead"
  ]
}
