{
  "_meta": {
    "version": "1.0.0",
    "generated": "2026-01-31T00:00:00Z",
    "source": "auto-extracted from /ports/marthas-vineyard.html"
  },
  "port_slug": "marthas-vineyard",
  "port_name": "Martha's Vineyard",
  "port_pin": {
    "lat": 41.4535,
    "lon": -70.6048,
    "label": "Vineyard Haven (Tender Landing)"
  },
  "bbox_hint": {
    "south": 41.3,
    "west": -70.87,
    "north": 41.5,
    "east": -70.48
  },
  "poi_ids": [
    "marthas-vineyard-vineyard-haven",
    "marthas-vineyard-oak-bluffs",
    "marthas-vineyard-edgartown",
    "marthas-vineyard-gay-head"
  ]
}
